{
  "$schema": "../../../../schema/fragment.schema.json",
  "id": "auth/none",
  "axis": "auth",
  "label": "No authentication",
  "description": "Open API. Appropriate for an internal tool or a spike; authentication can be added later without changing the CRUD patterns.",
  "vars": { "name": "none" }
}
